{
  "$schema": "https://json-schema.org/draft/2020-12/schema",
  "$id": "clinic.schema.json",
  "title": "Clinic",
  "description": "Contract for one clinic demo. Group A (block-level) is constant across a specialty block — set once in blocks.json/tokens.json and referenced here. Group B (clinic-level) is populated per clinic. Every Group B field's provenance is tracked in data_status as web | client | missing (plus draft, for model-generated copy awaiting operator review, Phase 6b only). Fields marked x-build-blocking render a visible DATA NEEDED placeholder when missing — never a guess.",
  "type": "object",
  "additionalProperties": false,
  "required": ["slug", "block_id", "demo_token", "prospect_status", "display_name", "data_status"],
  "properties": {

    "block_id": {
      "$comment": "GROUP A — block-level. Values constant per specialty block.",
      "enum": ["dental", "vet", "ent", "ophthalmology", "derm-aesthetic", "plastic-surgery"]
    },
    "specialty": { "type": "string", "$comment": "Group A. Human-readable specialty, e.g. 'Dermatology & Aesthetics'." },
    "schema_org_type": {
      "enum": ["Dentist", "VeterinaryCare", "MedicalClinic", "Optician", "Physician", "MedicalBusiness"],
      "$comment": "Group A. JSON-LD @type used in Phase 6b."
    },
    "section_order": {
      "type": "array", "items": { "type": "string" },
      "$comment": "Group A. Normally inherited from blocks.json; a clinic-level override requires operator approval (rule 4)."
    },
    "palette_ref": { "type": "string", "$comment": "Group A. Key into tokens.json, e.g. 'derm-aesthetic' or 'derm-aesthetic.variant'." },
    "allowed_content": {
      "type": "object", "additionalProperties": false,
      "properties": {
        "testimonials": { "type": "boolean", "default": false },
        "before_after": { "type": "boolean", "default": false },
        "superiority_claims": { "type": "boolean", "default": false }
      },
      "$comment": "Group A. Block-level intent flags. Rendering additionally requires the same flag to be explicitly true in compliance.json (rule 3) — BOTH gates must pass."
    },

    "slug": {
      "type": "string", "pattern": "^[a-z0-9]+(-[a-z0-9]+)*$",
      "$comment": "GROUP B from here down — clinic-level, populated per clinic."
    },
    "demo_token": {
      "type": "string", "pattern": "^[a-z0-9]{6,}$",
      "$comment": "Random, unguessable, never reused (rule 7). Demo URL = /demo/<block_id>/<slug>-<demo_token>/. Routing datum, not clinic data — generated by the pipeline."
    },
    "prospect_status": {
      "enum": ["prospect", "contacted", "demo-sent", "negotiating", "signed", "declined"],
      "$comment": "Sales-funnel state, shown on HQ pages only. 'signed' clinics graduate to their dedicated go-live repo."
    },

    "display_name": { "type": "string", "x-build-blocking": true },
    "doctor_name": { "type": "string" },
    "qualifications": { "type": "string" },
    "council_reg_no": { "type": "string" },
    "years_experience": { "type": "number" },
    "bio": { "type": "string" },

    "services": {
      "type": "array", "x-build-blocking": true,
      "items": {
        "type": "object", "additionalProperties": false, "required": ["name"],
        "properties": { "name": { "type": "string" }, "description": { "type": "string" } }
      },
      "$comment": "The real differentiator. Never padded with generic specialty services the clinic didn't state."
    },
    "fees": {
      "type": "array",
      "items": {
        "type": "object", "additionalProperties": false, "required": ["service", "amount"],
        "properties": { "service": { "type": "string" }, "amount": { "type": "string" } }
      },
      "$comment": "Optional; only what the clinic explicitly consents to publish (intake Q12)."
    },

    "address_full": { "type": "string", "x-build-blocking": true },
    "sector": { "type": "string" },
    "city": { "type": "string" },
    "pincode": { "type": "string", "pattern": "^[1-9][0-9]{5}$" },
    "lat": { "type": "number" },
    "lng": { "type": "number" },
    "place_id": { "type": "string" },
    "maps_embed_url": { "type": "string", "format": "uri" },

    "phone_e164": {
      "type": "string", "pattern": "^\\+[1-9][0-9]{6,14}$", "x-build-blocking": true,
      "$comment": "Build-blocking is satisfied by phone_e164 OR whatsapp OR email — at least one contact method (see x-build-blocking-note). If a supplied number does not parse cleanly to E.164, flag it in DATA-NEEDED — never invent digits."
    },
    "whatsapp": { "type": "string", "pattern": "^\\+[1-9][0-9]{6,14}$" },
    "email": { "type": "string", "format": "email" },
    "hours": {
      "type": "object", "additionalProperties": false,
      "properties": {
        "mon": { "type": "string" }, "tue": { "type": "string" }, "wed": { "type": "string" },
        "thu": { "type": "string" }, "fri": { "type": "string" }, "sat": { "type": "string" },
        "sun": { "type": "string" }
      },
      "$comment": "Free-text per day, e.g. '10:00–14:00, 17:00–21:00' or 'Closed'."
    },
    "languages": { "type": "array", "items": { "type": "string" } },

    "existing_url": { "type": "string", "format": "uri" },
    "existing_url_status": { "enum": ["none", "thin", "functional", "unknown"] },
    "gbp_url": { "type": "string", "format": "uri" },

    "rating": {
      "type": "object", "additionalProperties": false, "required": ["value", "count", "source_url", "pulled_on"],
      "properties": {
        "value": { "type": "number", "minimum": 0, "maximum": 5 },
        "count": { "type": "integer", "minimum": 0 },
        "source_url": { "type": "string", "format": "uri" },
        "pulled_on": { "type": "string", "format": "date" }
      },
      "$comment": "Rule 2: always a dated snapshot with source. Never from memory. (review_count lives here as 'count'.)"
    },
    "reviews": {
      "type": "array",
      "items": {
        "type": "object", "additionalProperties": false,
        "required": ["text", "author", "source", "pulled_on", "compliance_checked"],
        "properties": {
          "text": { "type": "string" },
          "author": { "type": "string" },
          "source": { "type": "string", "format": "uri" },
          "pulled_on": { "type": "string", "format": "date" },
          "compliance_checked": { "type": "boolean" }
        }
      },
      "$comment": "Rule 2: every entry must also have a row in /intake/reviews-compliance-log.md. Renders only if compliance gate passes AND compliance_checked is true."
    },

    "primary_keyword": { "type": "string" },
    "secondary_keywords": { "type": "array", "items": { "type": "string" } },
    "meta_title": { "type": "string", "maxLength": 65 },
    "meta_description": { "type": "string", "maxLength": 160 },
    "usp": { "type": "string", "$comment": "One line from the clinic (intake Q13) — never composed by the model." },

    "logo": { "type": "string" },
    "headshot": { "type": "string" },
    "interior_photos": { "type": "array", "items": { "type": "string" } },

    "data_status": {
      "type": "object",
      "additionalProperties": { "enum": ["web", "client", "missing", "draft"] },
      "$comment": "One entry per Group B field above (keyed by field name). 'draft' is legal only for meta_title/meta_description (Phase 6b generated copy awaiting review). This object drives DATA-NEEDED.md and the QA pass.",
      "x-build-blocking-note": "Build-blocking set: display_name, address_full, services, and at least ONE of {phone_e164, whatsapp, email}. Everything else degrades gracefully to a placeholder or an omitted section."
    },
    "sources": {
      "type": "object",
      "additionalProperties": { "type": "string", "format": "uri" },
      "$comment": "For every field with data_status 'web': the source URL it was pulled from (rule 1)."
    }
  }
}
