{
  "block_id": "derm-aesthetic",
  "specialty": "Dermatology & Aesthetics",
  "schema_org_type": "MedicalClinic",
  "palette_ref": "derm-aesthetic",
  "allowed_content": { "testimonials": false, "before_after": false, "superiority_claims": false },

  "slug": "marwa-deshmukh",
  "demo_token": "16187fc2",
  "prospect_status": "prospect",

  "display_name": "Dr. Marwa Deshmukh",
  "sector": "Nerul, Sector 15",
  "city": "Navi Mumbai",

  "data_status": {
    "display_name": "client",
    "sector": "client",
    "city": "client",
    "doctor_name": "missing",
    "qualifications": "missing",
    "council_reg_no": "missing",
    "years_experience": "missing",
    "bio": "missing",
    "services": "missing",
    "fees": "missing",
    "address_full": "missing",
    "pincode": "missing",
    "lat": "missing",
    "lng": "missing",
    "place_id": "missing",
    "maps_embed_url": "missing",
    "phone_e164": "missing",
    "whatsapp": "missing",
    "email": "missing",
    "hours": "missing",
    "languages": "missing",
    "existing_url": "missing",
    "existing_url_status": "missing",
    "gbp_url": "missing",
    "rating": "missing",
    "reviews": "missing",
    "primary_keyword": "missing",
    "secondary_keywords": "missing",
    "meta_title": "missing",
    "meta_description": "missing",
    "usp": "missing",
    "logo": "missing",
    "headshot": "missing",
    "interior_photos": "missing"
  },
  "sources": {}
}
